{
  "$schema": "https://json-schema.org/draft/2020-12/schema",
  "$id": "https://jokicjovan.github.io/agent-prov/schemas/v0.4/pipeline_bundle.schema.json",
  "title": "Pipeline Bundle",
  "description": "Top-level container wrapping all records for a single pipeline run. Carries the integrity seal (bundle_hash) and the disclosure flag. Primary EU AI Act mapping: Art. 12(1), 12(2), 50(1).",
  "type": "object",
  "additionalProperties": false,
  "required": [
    "bundle_id",
    "record_type",
    "protocol_version",
    "pipeline_id",
    "session_id",
    "created_at",
    "disclosure_presented",
    "outcome",
    "records",
    "bundle_hash"
  ],
  "properties": {
    "bundle_id": {
      "$ref": "#/$defs/uuid",
      "description": "Unique identifier for this bundle. Schema metadata; no direct Act mapping."
    },
    "record_type": {
      "const": "pipeline_bundle",
      "description": "Discriminator identifying this object as a Pipeline Bundle."
    },
    "protocol_version": {
      "$ref": "#/$defs/semver",
      "description": "Provenance protocol version (semver). Schema metadata."
    },
    "pipeline_id": {
      "$ref": "#/$defs/uuid",
      "description": "Identifier of the pipeline this bundle captures. EU AI Act Art. 12(2)(c) - supports operational monitoring (Art. 26(5))."
    },
    "session_id": {
      "$ref": "#/$defs/uuid",
      "description": "Identifier of the execution session within the pipeline. EU AI Act Art. 12(2)(c) - supports operational monitoring."
    },
    "created_at": {
      "$ref": "#/$defs/iso8601_timestamp",
      "description": "ISO 8601 / RFC 3339 timestamp marking the moment the bundle was sealed (records list frozen, bundle_hash computed). Schema metadata supporting Art. 12(2) traceability."
    },
    "disclosure_presented": {
      "type": "boolean",
      "description": "Whether an AI-interaction disclosure was presented to the user during this pipeline run. EU AI Act Art. 50(1) - users must be informed they are interacting with an AI system."
    },
    "outcome": {
      "type": "string",
      "enum": ["completed", "aborted", "error"],
      "description": "Terminal outcome of the pipeline run as a whole. 'completed' = the run finished normally; 'error' = the run finished but at least one step failed; 'aborted' = the run was stopped before reaching its end. EU AI Act Art. 12(2)(a) - records at the run level whether the system malfunctioned or was halted, complementing per-step status."
    },
    "oversight_regime": {
      "type": "string",
      "enum": ["standard", "biometric_dual_control"],
      "description": "Human-oversight regime this run declares itself under. Optional; an absent value is treated as 'standard' (single-reviewer human intervention permitted). 'biometric_dual_control' declares the run subject to EU AI Act Art. 14(5): the two-person rule for biometric identification systems, under which every Human Intervention Record in the bundle must carry at least two distinct reviewer_id entries. The count constraint is a value-comparison JSON Schema cannot express against a bundle-level field, so it is enforced by the protocol validation layer at bundle seal time. The declaration binds the regime to the tamper-evident, signable bundle; it does not, on its own, prove the run genuinely belongs to the biometric population - that binding to an external system registration is a deployment concern outside the record stream."
    },
    "records": {
      "type": "array",
      "minItems": 1,
      "items": {
        "oneOf": [
          { "$ref": "https://jokicjovan.github.io/agent-prov/schemas/v0.4/agent_step.schema.json" },
          { "$ref": "https://jokicjovan.github.io/agent-prov/schemas/v0.4/tool_invocation.schema.json" },
          { "$ref": "https://jokicjovan.github.io/agent-prov/schemas/v0.4/human_intervention.schema.json" }
        ]
      },
      "description": "Ordered list of provenance records produced during the pipeline run. Each item must validate against exactly one of the Agent Step, Tool Invocation, or Human Intervention record schemas (discriminated by record_type). EU AI Act Art. 12(2) - the ordered chain is the traceability evidence."
    },
    "bundle_hash": {
      "$ref": "#/$defs/sha256_hex",
      "description": "SHA-256 hex digest computed over the canonical JSON of this bundle with the bundle_hash field itself removed. Provides a tamper-evident integrity seal for the entire record set. EU AI Act Art. 12(1) - the 'technically allow' obligation requires logs that are fit for evidentiary use, which mutable record sets are not. Verification recomputes the same exclusion-and-hash; mismatch indicates tampering. The canonical-JSON form follows RFC 8785 (JCS) - sorted keys, compact separators, UTF-8 with non-ASCII preserved, ECMAScript number formatting, no NaN/Infinity - so any verifier using a conformant JCS implementation reproduces the digest exactly."
    }
  },
  "$defs": {
    "uuid": {
      "type": "string",
      "pattern": "^[0-9a-f]{8}-[0-9a-f]{4}-[0-9a-f]{4}-[0-9a-f]{4}-[0-9a-f]{12}$",
      "description": "RFC 4122 UUID string in lowercase hex (canonical form for the protocol)."
    },
    "sha256_hex": {
      "type": "string",
      "pattern": "^[a-f0-9]{64}$",
      "description": "SHA-256 digest as 64 lowercase hex characters."
    },
    "iso8601_timestamp": {
      "type": "string",
      "format": "date-time",
      "description": "ISO 8601 / RFC 3339 timestamp with timezone."
    },
    "semver": {
      "type": "string",
      "pattern": "^(0|[1-9]\\d*)\\.(0|[1-9]\\d*)\\.(0|[1-9]\\d*)(?:-((?:0|[1-9]\\d*|\\d*[a-zA-Z-][0-9a-zA-Z-]*)(?:\\.(?:0|[1-9]\\d*|\\d*[a-zA-Z-][0-9a-zA-Z-]*))*))?(?:\\+([0-9a-zA-Z-]+(?:\\.[0-9a-zA-Z-]+)*))?$",
      "description": "Semantic version per semver.org."
    }
  }
}
