{
  "bundle_id": "72c9ac3f-9bcd-4e86-a500-a9fb97c1a749",
  "record_type": "pipeline_bundle",
  "protocol_version": "0.3.0",
  "pipeline_id": "c7a2e9d4-3b16-4f8a-9e20-1d5c8b7f2a44",
  "session_id": "cb49466b-8035-4d5c-95fd-defd7781b6c6",
  "created_at": "2026-07-04T00:05:46.884967Z",
  "disclosure_presented": true,
  "outcome": "completed",
  "records": [
    {
      "record_id": "2dd15ba6-f563-4418-9c85-efd77f2f37e4",
      "record_type": "agent_step",
      "protocol_version": "0.3.0",
      "pipeline_id": "c7a2e9d4-3b16-4f8a-9e20-1d5c8b7f2a44",
      "session_id": "cb49466b-8035-4d5c-95fd-defd7781b6c6",
      "agent_id": "researcher",
      "model_id": "mock-gpt-4o-mini",
      "model_version": "mock-gpt-4o-mini",
      "timestamp_start": "2026-07-04T00:05:46.883515Z",
      "timestamp_end": "2026-07-04T00:05:46.883595Z",
      "input_hash": "7b3d0163ba2572ff2a0daef69c2bb88e64bfa85d05ff0f8c2c78ac2daf160d97",
      "reference_data_id": null,
      "parent_record_id": null,
      "status": "success",
      "output_hash": "de62c2f9c47402138b183064f9e8a9ff6afcf41e3ef9cc27d583c10b21e579d3"
    },
    {
      "record_id": "3825bc5b-1b40-421b-ab73-72e626df6af5",
      "record_type": "tool_invocation",
      "protocol_version": "0.3.0",
      "pipeline_id": "c7a2e9d4-3b16-4f8a-9e20-1d5c8b7f2a44",
      "session_id": "cb49466b-8035-4d5c-95fd-defd7781b6c6",
      "agent_id": "researcher",
      "tool_name": "web_search",
      "tool_version": "1.0.0",
      "timestamp_start": "2026-07-04T00:05:46.884707Z",
      "timestamp_end": "2026-07-04T00:05:46.884742Z",
      "input_hash": "5d7724f36d29dbd6402f05c336e25fe18c07b3684743e70d291b0788687a1bf7",
      "reference_data_id": null,
      "parent_record_id": "2dd15ba6-f563-4418-9c85-efd77f2f37e4",
      "status": "success",
      "output_hash": "cede7d3f457a2c89dcea3a3e981347a865285944b0c9be38e2851fdae30b0987"
    },
    {
      "record_id": "4ca65d93-5533-415d-84bf-77f8ab01cda9",
      "record_type": "agent_step",
      "protocol_version": "0.3.0",
      "pipeline_id": "c7a2e9d4-3b16-4f8a-9e20-1d5c8b7f2a44",
      "session_id": "cb49466b-8035-4d5c-95fd-defd7781b6c6",
      "agent_id": "researcher",
      "model_id": "mock-gpt-4o-mini",
      "model_version": "mock-gpt-4o-mini",
      "timestamp_start": "2026-07-04T00:05:46.884769Z",
      "timestamp_end": "2026-07-04T00:05:46.884805Z",
      "input_hash": "2f4d9895d7753862cc07337e415e5d00c524d2fa7b3859f10c21160941e30706",
      "reference_data_id": null,
      "parent_record_id": "3825bc5b-1b40-421b-ab73-72e626df6af5",
      "status": "success",
      "output_hash": "549d893a868088f34915dfb4bacd9efe84d5c95ca14efb7c921732c428cca063"
    },
    {
      "record_id": "ca2630b5-80b0-4c00-ba20-017db76213b9",
      "record_type": "agent_step",
      "protocol_version": "0.3.0",
      "pipeline_id": "c7a2e9d4-3b16-4f8a-9e20-1d5c8b7f2a44",
      "session_id": "cb49466b-8035-4d5c-95fd-defd7781b6c6",
      "agent_id": "writer",
      "model_id": "mock-gpt-4o-mini",
      "model_version": "mock-gpt-4o-mini",
      "timestamp_start": "2026-07-04T00:05:46.884882Z",
      "timestamp_end": "2026-07-04T00:05:46.884899Z",
      "input_hash": "f057b92f25aa36adbae7a96b77342676b1f331d85ce687082fc9b61690dfacb0",
      "reference_data_id": null,
      "parent_record_id": "4ca65d93-5533-415d-84bf-77f8ab01cda9",
      "status": "success",
      "output_hash": "30e15ca47567460d5e9ef0fe070302f73872a535e1a987ac2020b15f019861c0"
    }
  ],
  "bundle_hash": "b83ab3e5ce35a4e180b6da3136a472c1ffb17288b86f3850c41cd559ae4b2699"
}