{
  "bundle_id": "f611ff3e-e3ad-477c-b762-3d4d87a15225",
  "record_type": "pipeline_bundle",
  "protocol_version": "0.4.0",
  "pipeline_id": "8f5e449c-dd8f-4a2d-91c6-db484350d39a",
  "session_id": "ac211790-72e5-4a45-8d84-95efbafbafa9",
  "created_at": "2026-07-05T01:12:30.758003Z",
  "disclosure_presented": true,
  "outcome": "completed",
  "records": [
    {
      "record_id": "db34c446-9e83-4faf-824c-baa808829bd3",
      "record_type": "agent_step",
      "protocol_version": "0.4.0",
      "pipeline_id": "8f5e449c-dd8f-4a2d-91c6-db484350d39a",
      "session_id": "ac211790-72e5-4a45-8d84-95efbafbafa9",
      "agent_id": "summarizer",
      "model_id": "gpt-4o-mini",
      "model_version": "gpt-4o-mini",
      "timestamp_start": "2026-07-05T01:12:26.475623Z",
      "timestamp_end": "2026-07-05T01:12:28.313643Z",
      "input_hash": "57a9d50bf6ba51cb882456ee7660c9a60b53fefaa5862fe36b6ac98beb439ecf",
      "reference_data_id": null,
      "parent_record_id": null,
      "runtime_metadata": {
        "run_id": "019f2fd5-766b-74c2-a66c-3042890ab0b5",
        "message_id": "lc_run--019f2fd5-766b-74c2-a66c-3042890ab0b5-0"
      },
      "status": "success",
      "output_hash": "54ebd4ad36ce862c6c3f7b7bda5c7a87bda91a2ae85563c393a593ebc1786281"
    },
    {
      "record_id": "9de465bc-da93-468b-aec1-54b1be957cbb",
      "record_type": "human_intervention",
      "protocol_version": "0.4.0",
      "pipeline_id": "8f5e449c-dd8f-4a2d-91c6-db484350d39a",
      "session_id": "ac211790-72e5-4a45-8d84-95efbafbafa9",
      "reviewer_id": [
        "reviewer:editor-01"
      ],
      "reviewer_role": "editor",
      "action_type": "edited",
      "output_before_hash": "6213d6a704d2490cc45f298345b92c61a6fbbc46c4d8d6c1a9f5d09336ed2cf7",
      "output_after_hash": "1debe9d8bd2271de31e9d624baf70f501b4ef7b1bf415ab51c96d1e1c78e7c11",
      "intervention_timestamp": "2026-07-05T01:12:28.317437Z",
      "parent_record_id": "db34c446-9e83-4faf-824c-baa808829bd3",
      "justification_hash": "8e8b08c1dbffc072c15bb4b4ce7b8c94e9c0959fc896ec34c213bcb7c4e7402d"
    },
    {
      "record_id": "91f5c66b-e914-4690-9431-b6a63fadf92e",
      "record_type": "agent_step",
      "protocol_version": "0.4.0",
      "pipeline_id": "8f5e449c-dd8f-4a2d-91c6-db484350d39a",
      "session_id": "ac211790-72e5-4a45-8d84-95efbafbafa9",
      "agent_id": "finalizer",
      "model_id": "gpt-4o-mini",
      "model_version": "gpt-4o-mini",
      "timestamp_start": "2026-07-05T01:12:28.322278Z",
      "timestamp_end": "2026-07-05T01:12:30.750465Z",
      "input_hash": "a7a9d8b8c8b7d819190a8e42a53f6ff4b27442d9d03d88ee9c0b810082014543",
      "reference_data_id": null,
      "parent_record_id": "9de465bc-da93-468b-aec1-54b1be957cbb",
      "runtime_metadata": {
        "run_id": "019f2fd5-7da2-7313-be6b-8944d803c089",
        "message_id": "lc_run--019f2fd5-7da2-7313-be6b-8944d803c089-0"
      },
      "status": "success",
      "output_hash": "3dbed7dc39fab4d02578ab04e26a94fdee61c71b72d0ed0f77e6869c67495a92"
    },
    {
      "record_id": "5fb2cb20-1093-4078-8606-e401cae4688d",
      "record_type": "human_intervention",
      "protocol_version": "0.4.0",
      "pipeline_id": "8f5e449c-dd8f-4a2d-91c6-db484350d39a",
      "session_id": "ac211790-72e5-4a45-8d84-95efbafbafa9",
      "reviewer_id": [
        "reviewer:compliance-07"
      ],
      "reviewer_role": "compliance_officer",
      "action_type": "approved",
      "output_before_hash": "6ede5a3865c498096f24866a8d3880bbfbd1ace71311c04626d60c35ed39b03a",
      "output_after_hash": "6ede5a3865c498096f24866a8d3880bbfbd1ace71311c04626d60c35ed39b03a",
      "intervention_timestamp": "2026-07-05T01:12:30.754584Z",
      "parent_record_id": "91f5c66b-e914-4690-9431-b6a63fadf92e",
      "justification_hash": "79995e711204126f365746e06200e997d394b8dd9ee9d8b79dbb74fd188a00f6"
    }
  ],
  "bundle_hash": "d4079f2350c66de100e1fabf5ac372a08eb01ac5373ab816cd8cbc02be8ab699"
}