{
  "bundle_id": "9fbe154e-a47b-49cc-af98-333a7bf99c00",
  "record_type": "pipeline_bundle",
  "protocol_version": "0.2.0",
  "pipeline_id": "8d3fecf8-42d6-4f45-824f-7dde23407026",
  "session_id": "103adee3-a8e1-4c20-94ab-8756a0b48abd",
  "created_at": "2026-06-16T20:51:49.024783Z",
  "disclosure_presented": true,
  "outcome": "completed",
  "records": [
    {
      "record_id": "8f3b5338-9ddf-4c9d-9a8f-c564ec3e3692",
      "record_type": "tool_invocation",
      "protocol_version": "0.2.0",
      "pipeline_id": "8d3fecf8-42d6-4f45-824f-7dde23407026",
      "session_id": "103adee3-a8e1-4c20-94ab-8756a0b48abd",
      "agent_id": "researcher",
      "tool_name": "web_search",
      "tool_version": "unversioned",
      "timestamp_start": "2026-06-16T20:51:49.021658Z",
      "timestamp_end": "2026-06-16T20:51:49.022010Z",
      "input_hash": "43db217faadadc58f3abec361efa0164ff518e9be78233ba677e8e2e5eed8baa",
      "reference_data_id": null,
      "parent_record_id": null,
      "status": "success",
      "output_hash": "a6ff9c0630131ec5f0417e6b2dee03e864f2dd81d76d3c4a93a6de6308cdd773"
    },
    {
      "record_id": "72cf036d-0af2-4928-88de-ba3ebe705489",
      "record_type": "agent_step",
      "protocol_version": "0.2.0",
      "pipeline_id": "8d3fecf8-42d6-4f45-824f-7dde23407026",
      "session_id": "103adee3-a8e1-4c20-94ab-8756a0b48abd",
      "agent_id": "researcher",
      "model_id": "fake-researcher",
      "model_version": "fake-researcher",
      "timestamp_start": "2026-06-16T20:51:49.022298Z",
      "timestamp_end": "2026-06-16T20:51:49.022919Z",
      "input_hash": "49b480e0426c79d178513fded1a2b2c567b450c9fc55b908700e8e815353d75c",
      "reference_data_id": null,
      "parent_record_id": "8f3b5338-9ddf-4c9d-9a8f-c564ec3e3692",
      "status": "success",
      "output_hash": "5179bac91a4374bf7367de805828f790edd3fc9ef0fceaac1f21a1842f7c5f55"
    },
    {
      "record_id": "a4aeb0ff-3871-4b1b-a998-e1d6c7b70e3d",
      "record_type": "agent_step",
      "protocol_version": "0.2.0",
      "pipeline_id": "8d3fecf8-42d6-4f45-824f-7dde23407026",
      "session_id": "103adee3-a8e1-4c20-94ab-8756a0b48abd",
      "agent_id": "summarizer",
      "model_id": "fake-summarizer",
      "model_version": "fake-summarizer",
      "timestamp_start": "2026-06-16T20:51:49.024095Z",
      "timestamp_end": "2026-06-16T20:51:49.024180Z",
      "input_hash": "576ee200063154f433647c7092bcd66e919bfc8d3dba6aec22416abccc1db1d7",
      "reference_data_id": null,
      "parent_record_id": "72cf036d-0af2-4928-88de-ba3ebe705489",
      "status": "success",
      "output_hash": "635bcb5e60518260e2a382b16db42802d15afba82a6f76877945b8798ea217d3"
    },
    {
      "record_id": "b331b69c-e7f2-4b79-aad5-93bf0c6fdc7a",
      "record_type": "agent_step",
      "protocol_version": "0.2.0",
      "pipeline_id": "8d3fecf8-42d6-4f45-824f-7dde23407026",
      "session_id": "103adee3-a8e1-4c20-94ab-8756a0b48abd",
      "agent_id": "writer",
      "model_id": "fake-writer",
      "model_version": "fake-writer",
      "timestamp_start": "2026-06-16T20:51:49.024543Z",
      "timestamp_end": "2026-06-16T20:51:49.024606Z",
      "input_hash": "ca9f1ef6898ef8e509a100f79e6b9104cd92350c2160cc433f70421ad5330c9a",
      "reference_data_id": null,
      "parent_record_id": "a4aeb0ff-3871-4b1b-a998-e1d6c7b70e3d",
      "status": "success",
      "output_hash": "a35a546d3f01fd2974cfa74f3be2c89321be862c9008815a8ab96236a2b6c8c0"
    }
  ],
  "bundle_hash": "01396a5f10995342db45b383fb1262c6227e926eba552d847566a4a447012354"
}